{
  "$schema": "http://json-schema.org/draft-07/schema#",
  "title": "LL1Analysis",
  "description": "Output of plcc-ll1: LL(1) analysis of a grammar.",
  "type": "object",
  "required": ["is_ll1", "start_symbol", "first_sets", "follow_sets", "predict_sets", "parse_table", "conflicts", "left_recursion", "arbno"],
  "properties": {
    "is_ll1":         { "type": "boolean" },
    "start_symbol":   { "type": "string" },
    "first_sets":     {
      "type": "object",
      "additionalProperties": { "type": "array", "items": { "type": "string" } }
    },
    "follow_sets":    {
      "type": "object",
      "additionalProperties": { "type": "array", "items": { "type": "string" } }
    },
    "predict_sets":   {
      "type": "object",
      "additionalProperties": {
        "type": "array",
        "items": { "type": "array", "items": { "type": "string" } }
      }
    },
    "parse_table":    {
      "type": "object",
      "additionalProperties": {
        "type": "object",
        "additionalProperties": {
          "type": "object",
          "required": ["alt", "production"],
          "properties": {
            "alt": { "type": ["string", "null"] },
            "production": {
              "type": "array",
              "items": {
                "type": "object",
                "required": ["symbol", "field"],
                "properties": {
                  "symbol": { "type": "string" },
                  "field":  { "type": ["string", "null"] }
                }
              }
            }
          }
        }
      }
    },
    "conflicts": {
      "type": "array",
      "items": {
        "type": "object",
        "required": ["nonterminal", "lookahead", "productions"],
        "properties": {
          "nonterminal": { "type": "string" },
          "lookahead":   { "type": "string" },
          "productions": {
            "type": "array",
            "items": {
              "type": "object",
              "required": ["alt", "production"],
              "properties": {
                "alt": { "type": ["string", "null"] },
                "production": {
                  "type": "array",
                  "items": {
                    "type": "object",
                    "required": ["symbol", "field"],
                    "properties": {
                      "symbol": { "type": "string" },
                      "field":  { "type": ["string", "null"] }
                    }
                  }
                }
              }
            }
          }
        }
      }
    },
    "left_recursion": {
      "type": "array",
      "items": {
        "type": "object",
        "required": ["cycle"],
        "properties": {
          "cycle": { "type": "array", "items": { "type": "string" } }
        }
      }
    },
    "arbno": {
      "type": "object",
      "additionalProperties": {
        "type": "object",
        "required": ["rhs", "separator", "lookahead"],
        "properties": {
          "rhs": {
            "type": "array",
            "items": {
              "type": "object",
              "required": ["symbol", "field", "is_terminal"],
              "properties": {
                "symbol":      { "type": "string" },
                "field":       { "type": ["string", "null"] },
                "is_terminal": { "type": "boolean" }
              }
            }
          },
          "separator": { "type": ["string", "null"] },
          "lookahead": { "type": "array", "items": { "type": "string" } }
        }
      }
    }
  }
}
