{
  "is_ll1": true,
  "start_symbol": "Program",
  "first_sets": {
    "Program": [
      "NUM"
    ]
  },
  "follow_sets": {
    "Program": [
      "eof"
    ]
  },
  "predict_sets": {
    "Program": [
      [
        "NUM"
      ]
    ]
  },
  "parse_table": {
    "Program": {
      "NUM": {
        "alt": null,
        "production": [
          {
            "symbol": "NUM",
            "field": null
          }
        ]
      }
    }
  },
  "conflicts": [],
  "left_recursion": [],
  "arbno": {}
}
